title,abstract
Mitigating backdoor attacks in federated learning,"Malicious clients can attack federated learning systems using malicious data, including backdoor samples, during the training phase. The compromised global model will perform well on the validation dataset designed for the task, but a small subset of data with backdoor patterns may trigger the model to make a wrong prediction. There has been an arms race between attackers who tried to conceal attacks and defenders who tried to detect attacks during the aggregation stage of training on the server-side. In this work, we propose a new and effective method to mitigate backdoor attacks after the training phase. Specifically, we design a federated pruning method to remove redundant neurons in the network and then adjust the model's extreme weight values. Our experiments conducted on distributed Fashion-MNIST show that our method can reduce the average attack success rate from 99.7% to 1.9% with a 5.5% loss of test accuracy on the validation dataset. To minimize the pruning influence on test accuracy, we can fine-tune after pruning, and the attack success rate drops to 6.4%, with only a 1.7% loss of test accuracy. Further experiments under Distributed Backdoor Attacks on CIFAR-10 also show promising results that the average attack success rate drops more than 70% with less than 2% loss of test accuracy on the validation dataset."
Baffle: Backdoor detection via feedback-based federated learning,"Recent studies have shown that federated learning (FL) is vulnerable to poisoning attacks that inject a backdoor into the global model. These attacks are effective even when performed by a single client, and undetectable by most existing defensive techniques. In this paper, we propose Backdoor detection via Feedback-based Federated Learning (BAFFLE), a novel defense to secure FL against backdoor attacks. The core idea behind BAFFLE is to leverage data of multiple clients not only for training but also for uncovering model poisoning. We exploit the availability of diverse datasets at the various clients by incorporating a feedback loop into the FL process, to integrate the views of those clients when deciding whether a given model update is genuine or not. We show that this powerful construct can achieve very high detection rates against state-of-the-art backdoor attacks, even when relying on straightforward methods to validate the model. Through empirical evaluation using the CIFAR-10 and FEMNIST datasets, we show that by combining the feedback loop with a method that suspects poisoning attempts by assessing the per-class classification performance of the updated model, BAFFLE reliably detects state-of-the-art backdoor attacks with a detection accuracy of 100% and a false-positive rate below 5%. Moreover, we show that our solution can detect adaptive attacks aimed at bypassing the defense."
Can you really backdoor federated learning?,"The decentralized nature of federated learning makes detecting and defending against adversarial attacks a challenging task. This paper focuses on backdoor attacks in the federated learning setting, where the goal of the adversary is to reduce the performance of the model on targeted tasks while maintaining good performance on the main task. Unlike existing works, we allow non-malicious clients to have correctly labeled samples from the targeted tasks. We conduct a comprehensive study of backdoor attacks and defenses for the EMNIST dataset, a real-life, user-partitioned, and non-iid dataset. We observe that in the absence of defenses, the performance of the attack largely depends on the fraction of adversaries present and the ""complexity'' of the targeted task. Moreover, we show that norm clipping and ""weak'' differential privacy mitigate the attacks without hurting the overall performance. We have implemented the attacks and defenses in TensorFlow Federated (TFF), a TensorFlow framework for federated learning. In open-sourcing our code, our goal is to encourage researchers to contribute new attacks and defenses and evaluate them on standard federated datasets."
Learning to detect malicious clients for robust federated learning,"Federated learning systems are vulnerable to attacks from malicious clients. As the central server in the system cannot govern the behaviors of the clients, a rogue client may initiate an attack by sending malicious model updates to the server, so as to degrade the learning performance or enforce targeted model poisoning attacks (a.k.a. backdoor attacks). Therefore, timely detecting these malicious model updates and the underlying attackers becomes critically important. In this work, we propose a new framework for robust federated learning where the central server learns to detect and remove the malicious model updates using a powerful detection model, leading to targeted defense. We evaluate our solution in both image classification and sentiment analysis tasks with a variety of machine learning models. Experimental results show that our solution ensures robust federated learning that is resilient to both the Byzantine attacks and the targeted model poisoning attacks."
From Enhanced Coinduction towards Enhanced Induction,"There exist a rich and well-developed theory of enhancements of the coinduction proof method, widely used on behavioural relations such as bisimilarity. We study how to develop an analogous theory for inductive behaviour relations, i.e., relations defined from inductive observables. Similarly to the coinductive setting, our theory makes use of (semi)-progressions of the form R->F(R), where R is a relation on processes and F is a function on relations, meaning that there is an appropriate match on the transitions that the processes in R can perform in which the derivatives are in F(R). For a given preorder, an enhancement corresponds to a function sound, i.e., one for which R->F(R) implies that R is contained in the preorder; and similarly for equivalences. We introduce weights on the observables of an inductive relation, and a weight-preserving condition on functions that guarantees soundness. We show that the class of weight-preserving functions contains non-trivial functions and enjoys closure properties with respect to desirable function constructors, so to be able to derive sophisticated sound functions (and hence sophisticated proof techniques) from simpler ones. We consider both strong semantics (in which all actions are treated equally) and weak semantics (in which one abstracts from internal transitions). We test our enhancements on a few non-trivial examples."
Robust aggregation for federated learning,"Federated learning is the centralized training of statistical models from decentralized data on mobile devices while preserving the privacy of each device. We present a robust aggregation approach to make federated learning robust to settings when a fraction of the devices may be sending corrupted updates to the server. The approach relies on a robust aggregation oracle based on the geometric median, which returns a robust aggregate using a constant number of iterations of a regular non-robust averaging oracle. The robust aggregation oracle is privacy-preserving, similar to the non-robust secure average oracle it builds upon. We establish its convergence for least squares estimation of additive models. We provide experimental results with linear models and deep networks for three tasks in computer vision and natural language processing. The robust aggregation approach is agnostic to the level of corruption; it outperforms the classical aggregation approach in terms of robustness when the level of corruption is high, while being competitive in the regime of low corruption. Two variants, a faster one with one-step robust aggregation and another one with on-device personalization, round off the paper."
Crfl: Certifiably robust federated learning against backdoor attacks,"Federated Learning (FL) as a distributed learning paradigm that aggregates information from diverse clients to train a shared global model, has demonstrated great success. However, malicious clients can perform poisoning attacks and model replacement to introduce backdoors into the trained global model. Although there have been intensive studies designing robust aggregation methods and empirical robust federated training protocols against backdoors, existing approaches lack robustness certification. This paper provides the first general framework, Certifiably Robust Federated Learning (CRFL), to train certifiably robust FL models against backdoors. Our method exploits clipping and smoothing on model parameters to control the global model smoothness, which yields a sample-wise robustness certification on backdoors with limited magnitude. Our certification also specifies the relation to federated learning parameters, such as poisoning ratio on instance level, number of attackers, and training iterations. Practically, we conduct comprehensive experiments across a range of federated datasets, and provide the first benchmark for certified robustness against backdoor attacks in federated learning."
Dba: Distributed backdoor attacks against federated learning,"Backdoor attacks aim to manipulate a subset of training data by injecting adversarial triggers such that machine learning models trained on the tampered dataset will make arbitrarily (targeted) incorrect prediction on the testset with the same trigger embedded. While federated learning (FL) is capable of aggregating information provided by different parties for training a better model, its distributed learning methodology and inherently heterogeneous data distribution across parties may bring new vulnerabilities. In addition to recent centralized backdoor attacks on FL where each party embeds the same global trigger during training, we propose the distributed backdoor attack (DBA) --- a novel threat assessment framework developed by fully exploiting the distributed nature of FL. DBA decomposes a global trigger pattern into separate local patterns and embed them into the training set of different adversarial parties respectively. Compared to standard centralized backdoors, we show that DBA is substantially more persistent and stealthy against FL on diverse datasets such as finance and image data. We conduct extensive experiments to show that the attack success rate of DBA is significantly higher than centralized backdoors under different settings. Moreover, we find that distributed attacks are indeed more insidious, as DBA can evade two state-of-the-art robust FL algorithms against centralized backdoors. We also provide explanations for the effectiveness of DBA via feature visual interpretation and feature importance ranking. To further explore the properties of DBA, we test the attack performance by varying different trigger factors, including local trigger variations (size, gap, and location), scaling factor in FL, data distribution, and poison ratio and interval. Our proposed DBA and thorough evaluation results shed lights on characterizing the robustness of FL."
Backdoor attacks and defenses in feature-partitioned collaborative learning,"Since there are multiple parties in collaborative learning, malicious parties might manipulate the learning process for their own purposes through backdoor attacks. However, most of existing works only consider the federated learning scenario where data are partitioned by samples. The feature-partitioned learning can be another important scenario since in many real world applications, features are often distributed across different parties. Attacks and defenses in such scenario are especially challenging when the attackers have no labels and the defenders are not able to access the data and model parameters of other participants. In this paper, we show that even parties with no access to labels can successfully inject backdoor attacks, achieving high accuracy on both main and backdoor tasks. Next, we introduce several defense techniques, demonstrating that the backdoor can be successfully blocked by a combination of these techniques without hurting main task accuracy. To the best of our knowledge, this is the first systematical study to deal with backdoor attacks in the feature-partitioned collaborative learning framework."
Federated learning in adversarial settings,"Federated Learning enables entities to collaboratively learn a shared prediction model while keeping their training data locally. It prevents data collection and aggregation and, therefore, mitigates the associated privacy risks. However, it still remains vulnerable to various security attacks where malicious participants aim at degrading the generated model, inserting backdoors, or inferring other participants' training data. This paper presents a new federated learning scheme that provides different trade-offs between robustness, privacy, bandwidth efficiency, and model accuracy. Our scheme uses biased quantization of model updates and hence is bandwidth efficient. It is also robust against state-of-the-art backdoor as well as model degradation attacks even when a large proportion of the participant nodes are malicious. We propose a practical differentially private extension of this scheme which protects the whole dataset of participating entities. We show that this extension performs as efficiently as the non-private but robust scheme, even with stringent privacy requirements but are less robust against model degradation and backdoor attacks. This suggests a possible fundamental trade-off between Differential Privacy and robustness."
Effectful Program Distancing,"Semantics is traditionally concerned with program equivalence, in which all pairs of programs which are \emph{not} equivalent are treated the same, and simply dubbed as incomparable. In recent years, various forms of program \emph{metrics} have been introduced such that the distance between non-equivalent programs is measured as an element of an appropriate quantale. By letting the underlying quantale to \emph{vary} as the type of the compared programs become more complex, the recently introduced framework of differential logical relations allows for a new contextual form of reasoning. In this paper, we show that all this can be generalised to \emph{effectful} higher-order programs, in which not only the \emph{values}, but also the \emph{effects} computations produce can be appropriately distanced in a principled way. We show that the resulting framework is flexible, allowing various forms of effects to be handled, and that it provides compact and informative judgments about program differences."
Blockchain for federated learning toward secure distributed machine learning systems: a systemic survey,"Federated learning (FL) is a promising decentralized deep learning technology, which allows users to update models cooperatively without sharing their data. FL is reshaping existing industry paradigms for mathematical modeling and analysis, enabling an increasing number of industries to build privacy-preserving, secure distributed machine learning models. However, the inherent characteristics of FL have led to problems such as privacy protection, communication cost, systems heterogeneity, and unreliability model upload in actual operation. Interestingly, the integration with Blockchain technology provides an opportunity to further improve the FL security and performance, besides increasing its scope of applications. Therefore, we denote this integration of Blockchain and FL as the Blockchain-based federated learning (BCFL) framework. This paper introduces an in-depth survey of BCFL and discusses the insights of such a new paradigm. In particular, we first briefly introduce the FL technology and discuss the challenges faced by such technology. Then, we summarize the Blockchain ecosystem. Next, we highlight the structural design and platform of BCFL. Furthermore, we present the attempts ins improving FL performance with Blockchain and several combined applications of incentive mechanisms in FL. Finally, we summarize the industrial application scenarios of BCFL."
Mitigating data poisoning attacks on a federated learning-edge computing network,"Edge Computing (EC) has seen a continuous rise in its popularity as it provides a solution to the latency and communication issues associated with edge devices transferring data to remote servers. EC achieves this by bringing the cloud closer to edge devices. Even though EC does an excellent job of solving the latency and communication issues, it does not solve the privacy issues associated with users transferring personal data to the nearby edge server. Federated Learning (FL) is an approach that was introduced to solve the privacy issues associated with data transfers to distant servers. FL attempts to resolve this issue by bringing the code to the data, which goes against the traditional way of sending the data to remote servers. In FL, the data stays on the source device, and a Machine Learning (ML) model used to train the local data is brought to the end device instead. End devices train the ML model using local data and then send the model updates back to the server for aggregation. However, this process of asking random devices to train a model using its local data has potential risks such as a participant poisoning the model using malicious data for training to produce bogus parameters. In this paper, an approach to mitigate data poisoning attacks in a federated learning setting is investigated. The application of the approach is highlighted, and the practical and secure nature of this approach is illustrated as well using numerical results."
A new ensemble adversarial attack powered by long-term gradient memories,"Deep neural networks are vulnerable to adversarial attacks. More importantly, some adversarial examples crafted against an ensemble of pre-trained source models can transfer to other new target models, thus pose a security threat to black-box applications (when the attackers have no access to the target models). Despite adopting diverse architectures and parameters, source and target models often share similar decision boundaries. Therefore, if an adversary is capable of fooling several source models concurrently, it can potentially capture intrinsic transferable adversarial information that may allow it to fool a broad class of other black-box target models. Current ensemble attacks, however, only consider a limited number of source models to craft an adversary, and obtain poor transferability. In this paper, we propose a novel black-box attack, dubbed Serial-Mini-Batch-Ensemble-Attack (SMBEA). SMBEA divides a large number of pre-trained source models into several mini-batches. For each single batch, we design 3 new ensemble strategies to improve the intra-batch transferability. Besides, we propose a new algorithm that recursively accumulates the “long-term” gradient memories of the previous batch to the following batch. This way, the learned adversarial information can be preserved and the inter-batch transferability can be improved. Experiments indicate that our method outperforms state-of-the-art ensemble attacks over multiple pixel-to-pixel vision tasks including image translation and salient region prediction. Our method successfully fools two online black-box saliency prediction systems including DeepGaze-II (Kummerer 2017) and SALICON (Huang et al. 2017). Finally, we also contribute a new repository to promote the research on adversarial attack and defense over pixel-to-pixel tasks: https://github.com/CZHQuality/AAA-Pix2pix."
On Incorrectness Logic and Kleene Algebra with Top and Tests,"Kleene algebra with tests (KAT) is a foundational equational framework for reasoning about programs. KAT has found applications in several areas, including program transformations, networking, compiler optimization, and more. In his seminal work, Kozen proved that KAT subsumes propositional Hoare logic, showing that one can reason about the (partial) correctness of while programs by means of the equational theory of KAT.In this work, we investigate the support that KAT provides for reasoning about incorrectness, instead, as embodied by O’hearn’s recently proposed incorrectness logic. We show that KAT cannot directly express incorrectness logic. The main reason for this limitation can be traced to the fact that KAT cannot express explicitly the notion of codomain, which is essential to express incorrectness triples. To address this issue, we study Kleene algebra with Top and Tests (TopKAT), an extension of KAT with a top element. We show that TopKAT is powerful enough to express a codomain operation, to express incorrectness triples, and to prove all the rules of incorrectness logic sound. This shows that one can reason about the incorrectness of while-like programs by means of the equational theory of TopKAT."
Adversarial training in communication constrained federated learning,"Federated learning enables model training over a distributed corpus of agent data. However, the trained model is vulnerable to adversarial examples, designed to elicit misclassification. We study the feasibility of using adversarial training (AT) in the federated learning setting. Furthermore, we do so assuming a fixed communication budget and non-iid data distribution between participating agents. We observe a significant drop in both natural and adversarial accuracies when AT is used in the federated setting as opposed to centralized training. We attribute this to the number of epochs of AT performed locally at the agents, which in turn effects (i) drift between local models; and (ii) convergence time (measured in number of communication rounds). Towards this end, we propose FedDynAT, a novel algorithm for performing AT in federated setting. Through extensive experimentation we show that FedDynAT significantly improves both natural and adversarial accuracy, as well as model convergence time by reducing the model drift."
Provable defense against privacy leakage in federated learning from representation perspective,"Federated learning (FL) is a popular distributed learning framework that can reduce privacy risks by not explicitly sharing private data. However, recent works demonstrated that sharing model updates makes FL vulnerable to inference attacks. In this work, we show our key observation that the data representation leakage from gradients is the essential cause of privacy leakage in FL. We also provide an analysis of this observation to explain how the data presentation is leaked. Based on this observation, we propose a defense against model inversion attack in FL. The key idea of our defense is learning to perturb data representation such that the quality of the reconstructed data is severely degraded, while FL performance is maintained. In addition, we derive certified robustness guarantee to FL and convergence guarantee to FedAvg, after applying our defense. To evaluate our defense, we conduct experiments on MNIST and CIFAR10 for defending against the DLG attack and GS attack. Without sacrificing accuracy, the results demonstrate that our proposed defense can increase the mean squared error between the reconstructed data and the raw data by as much as more than 160X for both DLG attack and GS attack, compared with baseline defense methods. The privacy of the FL system is significantly improved."
Fat: Federated adversarial training,"Federated Adversarial Training (FAT) helps us address the data privacy and governance issues, meanwhile maintains the model robustness to the adversarial attack. However, the inner-maximization optimization of Adversarial Training can exacerbate the data heterogeneity among local clients, which triggers the pain points of Federated Learning. This makes that the straightforward combination of two paradigms shows the performance deterioration as observed in previous works. In this paper, we introduce an $\alpha$-Weighted Federated Adversarial Training ($\alpha$-WFAT) method to overcome this problem, which relaxes the inner-maximization of Adversarial Training into a lower bound friendly to Federated Learning. We present the theoretical analysis about this $\alpha$-weighted mechanism and its effect on the convergence of FAT. Empirically, the extensive experiments are conducted to comprehensively understand the characteristics of $\alpha$-WFAT, and the results on three benchmark datasets demonstrate $\alpha$-WFAT significantly outperforms FAT under different adversarial learning methods and federated optimization methods."
Oblivious Algebraic Data Types,"Secure computation allows multiple parties to compute joint functions over private data without leaking any sensitive data, typically using powerful cryptographic techniques. Writing secure applications using these techniques directly can be challenging, resulting in the development of several programming languages and compilers that aim to make secure computation accessible. Unfortunately, many of these languages either lack or have limited support for rich recursive data structures, like trees. In this paper, we propose a novel representation of structured data types, which we call oblivious algebraic data types, and a language for writing secure computations using them. This language combines dependent types with constructs for oblivious computation, and provides a security-type system which ensures that adversaries can learn nothing more than the result of a computation. Using this language, authors can write a single function over private data, and then easily build an equivalent secure computation according to a desired public view of their data."
